num,title
904,Production and Operations Management
796,Journal of the Transportation Research Forum
983,Rural Sociology
927,Redes
558,Journal of Agrarian Change
415,Indian Journal of Finance
741,Journal of Real Estate Literature
829,Migration Letters
723,Journal of Planning Education and Research
420,Industry and Innovation
25,African Journal of Agricultural and Resource Economics
22,Aestimum
819,Managerial and Decision Economics
211,Eastern-European Journal of Enterprise Technologies
1015,Socio-economic Review
954,Review of Economic Design
807,Latin American Economic Review
862,Oxford Review of Economic Policy
260,Ecosystem Services
1141,The RAND Journal of Economics
344,Financial Markets and Portfolio Management
87,Asia-Pacific Journal of Financial Studies
893,Population and Environment
30,Agenda
21,Advances in Life Course Research
330,European Urban and Regional Studies
690,Journal of Interdisciplinary History
1165,Thunderbird International Business Review
1175,Transnational Corporations Review
1036,Studies in Agricultural Economics
481,International Journal of Hospitality Management
1088,The European Journal of Health Economics
1144,The Review of Economic Studies
137,Case studies on transport policy
823,Mathematical Methods of Operations Research
630,Journal of Economic Perspectives
1119,The Journal of Legal Studies
186,Current History
202,Dissent
575,Journal of Australian Political Economy
992,Science and Public Policy
740,Journal of Quantitative Economics
441,International Finance
1216,World Trade Review
923,RSF
1124,The Journal of Private Equity
1134,The Korean Economic Review
292,Environmental innovation and societal transitions
221,Economia Politica
340,Financial Analysts Journal
393,History of Political Economy
1160,The journal of world investment and trade
644,Journal of Entrepreneurship and Public Policy
439,International Entrepreneurship and Management Journal
32,Agribusiness
128,Business and Economic Horizons
1090,The Extractive Industries and Society
296,Ethnic and Racial Studies
1118,The Journal of Law and Economics
647,Journal of Environmental Planning and Management
298,Eurasian Economic Review
494,International Journal of Political Economy
709,Journal of Management
824,Mathematics and Financial Economics
305,European Competition Journal
561,Journal of Agricultural and Environmental Ethics
379,Global Trade and Customs Journal
407,IZA Journal of Migration
672,Journal of Gambling Studies
267,Emerging Markets Review
687,"Journal of Industry, Competition and Trade"
409,Impact Assessment and Project Appraisal
164,Comparative European Politics
1139,The Professional Geographer
175,Contemporary Accounting Research
123,Business Ethics Quarterly
1126,The Journal of Regional Analysis and Policy
147,China Finance Review International
368,Global Business Review
717,Journal of Multinational Financial Management
35,Agricultural and Food Economics
602,Journal of Conflict Resolution
214,Econ Journal Watch
190,De Economist
810,Letters in Spatial and Resource Sciences
604,Journal of Consumer Policy
633,Journal of Economic Structures
313,European Journal of Political Research
1024,South Asia Economic Journal
918,Quantitative Economics
950,Review of Derivatives Research
429,Intellectual economics
660,Journal of Financial Economic Policy
62,Annals of the American Association of Geographers
418,Indonesian Journal of Geography
1115,The Journal of Index Investing
114,Boletin De La Asociacion De Geografos Espanoles
437,International Economics
16,Actuel Marx
907,Progress in geography
447,International Journal of Business and Globalisation
942,Resources Conservation and Recycling
470,International Journal of Energy Sector Management
316,European Journal of Social Security
162,Comparative Economic Research
895,Post-Communist Economies
666,Journal of Financial Services Research
82,Asia Europe Journal
837,NBER Macroeconomics Annual
887,Population
1034,Strategic Change
235,Economic Systems
599,Journal of Comparative Family Studies
328,European Transport Research Review
605,Journal of Contemporary African Studies
1117,The Journal of Investing
580,Journal of Behavioral and Experimental Economics
1171,Tourism Management
1021,Socius
603,Journal of Consumer Affairs
161,Cognitive Science
1084,The Engineering Economics
257,Economy and Society
1186,Transylvanian Review
445,International Journal of Agricultural Sustainability
478,International Journal of Geographical Information Science
204,E-Journal of international and comparative labour studies
1099,The International Journal of Microsimulation
899,Problemas del Desarrollo
662,Journal of Financial Intermediation
855,Operational Research
498,International Journal of Public Policy
993,Science and innovation
867,Papers in Regional Science
283,Environment and Planning C: Politics and Space
752,Journal of Small Business Management
1177,Transport Reviews
428,Insurance: Mathematics and Economics
91,Asian Affairs
1205,Womens Studies International Forum
158,Climate and Development
374,Global Finance Journal
1071,The Australasian Accounting Business and Finance Journal
816,Management Science Letters
2,Ab Imperio
341,Financial History Review
421,Information Development
234,Economic Record
274,Enterprise Development and Microfinance
822,Mathematical Finance
970,Review of Network Economics
608,Journal of Contemporary European Studies
924,RUDN Journal of Russian History
46,American Economic Review
444,International Interactions
54,Anatolia
528,International Regional Science Review
933,Regional and Sectoral Economic Studies
424,Innovation and Development
809,Law and Financial Markets Review
869,Party Politics
751,Journal of Security and Sustainability Issues
948,Review of African Political Economy
640,Journal of Educational and Social Research
309,European Journal of Economics and Economic Policies: Intervention
624,Journal of Economic Growth
1037,Studies in Business and Economics
1016,Sociologia
122,Business Economics
473,International Journal of Environmental Studies
848,Nordic Journal of Working Life Studies
536,International Review of Sociology
849,North American Actuarial Journal
171,Computers and Composition
757,Journal of South Asian Development
707,Journal of Macroeconomics
1018,Sociological Perspectives
795,Journal of the Royal Statistical Society: Series C (Applied Statistics)
831,Mineral Economics
196,Development
519,International Labor and Working-Class History
435,International Development Planning Review
406,IZA Journal of Labor Policy
460,International Journal of Ecological Economics and Statistics
1020,Sociology
488,International Journal of Law and Management
826,Mediterranean Journal of Social Sciences
1098,The International Journal of Management
405,IZA Journal of Labor Economics
206,ECONOMICS
109,Baltic region
1207,"Work, Employment and Society"
552,Journal of Accounting and Economics
310,European Journal of Industrial Relations
842,Nature Human Behaviour
308,European Journal of Comparative Economics
553,Journal of Accounting and Public Policy
684,Journal of Industrial Ecology
1111,The Journal of Economic Inequality
92,Asian Development Review
1027,South European Society and Politics
797,Journal of transport and health
93,Asian Economic Journal
1039,Studies in Economics and Finance
1120,The Journal of Men's Studies
1132,The Journal of Wealth Management
1197,Urban Water Journal
201,Disasters
11,Accounting and Business Research
289,Environmental Politics
471,International Journal of Entrepreneurship
220,Economia Aplicada
541,International Tax and Public Finance
380,Globalizations
1105,The Journal of Alternative Investments
1026,South East European Journal of Economics and Business
1166,Tijdschrift voor economische en sociale geografie
774,Journal of Urban Economics
745,Journal of Revenue and Pricing Management
714,Journal of Money Laundering Control
513,International Journal of Urban Sciences
247,Economics and Philosophy
173,Constitutional Political Economy
768,Journal of Time Series Analysis
888,Population Research and Policy Review
917,Publishing Research Quarterly
612,Journal of Demographic Economics
1096,The International Food and Agribusiness Management Review
184,Critique
1199,Venture Capital
555,Journal of Advanced Transportation
386,Harvard international review
861,Oxford Economic Papers
758,Journal of Sports Economics
594,Journal of Chinese Political Science
689,Journal of Interdisciplinary Economics
843,Nature Sustainability
106,Australian Journal of Management
1114,The Journal of Human Resources
195,Developing Economies
10,Accounting Horizons
901,Problems and Perspectives in Management
1146,The Review of Regional Studies
317,European Journal of Social Work
821,Marine Resource Economics
332,Evaluation and program planning
871,Perspectives on Global Development and Technology
1068,The Annals of Applied Statistics
503,International Journal of Strategic Property Management
806,Latin American Business Review
1180,Transportation Planning and Technology
674,Journal of Global Optimization
1095,The Indian Journal of Labour Economics
946,Rethinking Marxism
1170,Tourism Geographies
1163,Theory and Society
452,International Journal of Comparative Sociology
1215,World Review of Political Economy
535,International Review of Social History
89,Asia-Pacific Journal of Rural Development
625,Journal of Economic Integration
64,Annual Review of Economics
873,Planning Perspectives
617,Journal of Developmental Entrepreneurship
1066,The American Review of Public Administration
748,Journal of Risk and Uncertainty
505,International Journal of Sustainable Development and Planning
710,Journal of Management Accounting Research
453,International Journal of Computational Economics and Econometrics
1130,The Journal of Structured Finance
1188,Travel behaviour and society
1128,The Journal of Risk Finance
364,Geography Compass
732,Journal of Post Keynesian Economics
294,Erasmus Journal of Philosophy and Economics
451,International Journal of Communication
223,Economic Alternatives
884,Political Studies Review
1204,Wirtschaftsdienst
53,American Sociological Review
252,Economics of Governance
40,American Behavioral Scientist
676,Journal of Governance and Regulation
1075,The British Journal of Politics and International Relations
868,Partecipazione e Conflitto
905,Progress in Development Studies
1012,Socio-Economic Planning Sciences
546,Investigacion Economica
148,China Journal of Accounting Studies
412,Indian Economic Review
675,Journal of Globalization and Development
446,International Journal of Business Innovation and Research
239,Economic and Political Studies
858,Optimization Letters
1056,Technology and Culture
48,American Journal of Human Biology
572,Journal of Asian Public Policy
1157,The journal of economic asymmetries
811,Local Environment
1200,Voprosy Ekonomiki
874,Policy Studies
646,Journal of Environmental Economics and Policy
969,Review of Managerial Science
107,Australian Planner
683,Journal of Indonesian Economy and Business
691,Journal of International Business Studies
321,European Political Science Review
77,Applied Research in Quality of Life
1179,Transportation Letters
127,Business Strategy and The Environment
765,Journal of Tax Reform
125,Business History Review
922,Quarterly Journal of Political Science
1007,Social Service Review
200,Dialogues in Human Geography
248,Economics and Policy of Energy and the Environment
1143,The Review of Black Political Economy
658,Journal of Financial Crime
718,"Journal of Open Innovation: Technology, Market, and Complexity"
682,Journal of Income Distribution®
176,Contemporary South Asia
903,Problems of Post-Communism
1077,The China Quarterly
957,Review of Economics
454,International Journal of Construction Management
548,Investment Management and Financial Innovations
980,Revue De L'ofce
936,Research in Higher Education
573,Journal of Asian and African Studies
724,Journal of Policy Analysis and Management
1080,The Economic Journal
953,Review of Economic Analysis
711,Journal of Marketing Research
526,International Political Science Review
562,Journal of Agricultural and Resource Economics
642,Journal of Emerging Market Finance
79,Area Development and Policy
877,Polish journal of management studies
945,Restaurant Business
422,Information Sciences
830,Millennial Asia
556,Journal of African Business
57,Annals of Finance
135,Capitalism Nature Socialism
38,Agroecology and Sustainable Food Systems
799,Kybernetes
177,Contributions to Economics
0,AIDS and Behavior
929,Regional Science Inquiry
864,Pacific Rim Property Research Journal
1189,Tropical Geography
994,Scientific Annals of Economics and Business
84,Asia Pacific Journal of Management
39,Ambio
708,Journal of Macromarketing
728,Journal of Population Ageing
851,OR Spectrum
1092,The Geneva Risk and Insurance Review
329,European Union Politics
18,Administrative Sciences
979,Revista Internacional De Sociologia
361,Genus
358,Futures
133,Cambridge Review of International Affairs
984,Russian Journal of Economics
367,German Politics
1073,The B.E. Journal of Macroeconomics
1152,The Social Sciences
547,Investment Analysts Journal
189,DECISION
180,Critical Perspectives on Accounting
369,Global Business and Economics Review
366,German Law Journal
314,European Journal of Population
149,China Report
55,Annals of Actuarial Science
655,Journal of Family Issues
389,Historical Materialism
618,Journal of Eastern African Studies
450,International Journal of Climate Change Strategies and Management
303,European Business Law Review
926,Real Estate Management and Valuation
1042,Studies in Political Economy
616,Journal of Development Studies
63,Annals of the Association of American Geographers
1113,The Journal of Fixed Income
258,Economy of Region
914,Public Management Review
590,Journal of Business Venturing
275,Entrepreneurial Business and Economics Review
1043,Studies in family planning
286,Environmental Economics
97,Asian Population Studies
205,EC Tax Review
657,Journal of Financial Counseling and Planning
174,Construction Management and Economics
779,Journal of World Trade
387,Herald of the Russian Academy of Sciences
17,Administration
886,Politics and Governance
1149,The Service Industries Journal
583,Journal of Biosocial Science
987,SERIEs
817,Management and Organization Review
165,Comparative Migration Studies
263,Education Finance and Policy
952,Review of Development Finance
65,Annual Review of Political Science
49,American Journal of Political Science
493,International Journal of Pluralism and Economics Education
80,Argumenta Oeconomica
280,Environment and Planning B: Planning and Design
1153,The Sociological Review
104,Australian Geographer
411,India Review
6,Academy of Management Journal
353,Forum for Development Studies
1187,Transylvanian review of administrative sciences
210,Eastern Journal of European Studies
1145,The Review of International Organizations
520,International Labour Review
785,Journal of quantitative economics
915,Public Performance & Management Review
1094,The History of the Family
898,Prague Economic Papers
402,IMISCOE Research Series
251,Economics of Energy and Environmental Policy
182,Critical Social Policy
385,Hacienda Publica Espanola
323,European Review
576,Journal of Baltic Studies
1013,Socio-Economic Review
172,Conflict Management and Peace Science
508,International Journal of Technology
1085,The Engineering Economist
1148,The Scandinavian Journal of Economics
485,International Journal of Innovation and Sustainable Development
716,Journal of Mountain Science
486,International Journal of Innovation and Technology Management
771,Journal of Transport and Land Use
1159,The journal of the economics of ageing
157,Climate Risk Management
731,Journal of Population and Social Studies
413,Indian Growth and Development Review
13,"Accounting, Economics, and Law: A Convivium"
853,Omega
1174,Transition Studies Review
1104,The Journal of Agricultural Extension
1185,Transportmetrica A: Transport Science
1041,Studies in Microeconomics
870,"Peace Economics, Peace Science and Public Policy"
152,Chinese Journal of Urban and Environmental Studies
527,International Real Estate Review
427,Innovations
525,International Planning Studies
391,History of Economic Ideas
747,Journal of Risk Research
1183,Transportation Research Part B: Methodological
511,International Journal of Tourism Research
111,Basic Income Studies
456,International Journal of Cultural Policy
297,Eurasian Business Review
549,Italian Economic Journal
1212,World Patent Information
705,Journal of Legal Affairs and Dispute Resolution in Engineering and Construction
108,Baltic Journal of Economics
408,Iimb Management Review
37,Agris on-line Papers in Economics and Informatics
319,European Journal of Transport and Infrastructure Research
1194,Urban History
925,Rationality and Society
492,International Journal of Operational Research
1097,The International Journal of Human Resource Management
537,International Social Work
86,Asia-Pacific Financial Markets
19,Advanced Science Letters
499,International Journal of Rural Management
569,Journal of Asia-Pacific Business
390,Historical Social Research
360,"Gender, Technology and Development"
1190,Turkish Studies
783,Journal of food distribution research
585,Journal of British Studies
126,Business Horizons
1033,Strategic Analysis
673,Journal of Geographical Systems
896,Post-Soviet Affairs
593,Journal of Chinese Economic and Foreign Trade Studies
876,Policy and Society
652,Journal of European Real Estate Research
764,Journal of Systems Science and Information
459,International Journal of Disaster Risk Science
781,Journal of choice modelling
551,Japanese Journal of Political Science
154,City
301,European Accounting Review
1009,Socialism and Democracy
