num,title
591,Journal of Central Banking Theory and Practice
1031,State and Local Government Review
759,Journal of Statistical Computation and Simulation
812,Local Government Studies
469,International Journal of Energy Economics and Policy
322,European Research Studies Journal
472,International Journal of Entrepreneurship and Small Business
589,Journal of Business Research
1049,Sustainable Cities and Society
31,Agrekon
1169,Tourism Economics
256,Economies
9,Accounting
132,"Cambridge Journal of Regions, Economy and Society"
574,Journal of Asset Management
1081,The Economic and Labour Relations Review
33,Agricultural Economics
348,Food Security
1057,Technology in Society
713,Journal of Monetary Economics
436,International Economic Journal
343,Financial Management
8,Accident; analysis and prevention
649,Journal of Ethnic and Migration Studies
1010,Society
770,Journal of Transport Geography
131,Cambridge Journal of Economics
1112,The Journal of Extension
791,Journal of the History of Economic Thought
788,Journal of the Asia Pacific Economy
34,Agricultural Finance Review
337,Finance Research Letters
813,Macroeconomic Dynamics
193,Demographic Research
414,Indian Journal of Economics and Development
1001,Social Indicators Research
820,Marine Policy
1108,The Journal of Development Studies
352,Forest Policy and Economics
787,Journal of the American Statistical Association
653,Journal of European Social Policy
998,Social Forces
805,Landscape and Urban Planning
465,International Journal of Economics and Financial Issues
1135,The North American Journal of Economics and Finance
112,Behavioral and Brain Sciences
730,Journal of Population Research
636,Journal of Economics and Business
1122,The Journal of Politics
944,"Resources, Conservation and Recycling"
554,Journal of Advanced Research in Law and Economics
808,Law and Development Review
739,Journal of Public Policy
754,Journal of Social Policy
1087,The European Journal of Finance
1209,World Development
490,International Journal of Manpower
1140,The Quarterly Review of Economics and Finance
98,Asian Social Science
497,International Journal of Public Administration
351,Foreign Trade Review
262,Education Economics
3,Academic Journal of Interdisciplinary Studies
1133,The Journal of international studies
120,Brookings Papers on Economic Activity
606,Journal of Contemporary Asia
951,Review of Development Economics
706,"Journal of Legal, Ethical and Regulatory Issues"
977,Review of applied socio-economic research
614,Journal of Development Economics
935,Research in Economics
265,Electronic Markets
244,Economics Bulletin
773,Journal of Urban Affairs
477,International Journal of Game Theory
840,Natural Hazards Review
595,Journal of Cleaner Production
278,Environment and Development Economics
474,International Journal of Financial Research
620,Journal of Economic Behavior and Organization
529,International Review of Applied Economics
746,Journal of Reviews on Global Economics
865,Palgrave Communications
12,Accounting and Finance
426,Innovation: The European Journal of Social Science Research
982,Romanian Journal of Economic Forecasting
1038,Studies in Comparative International Development
550,Japan and the World Economy
71,Applied Economics
373,Global Environmental Politics
253,Economics of Innovation and New Technology
1044,Studies on Russian Economic Development
250,Economics of Education Review
110,Banks and Bank Systems
1069,The Annals of Regional Science
1206,Work and Occupations
59,Annals of Operations Research
1176,Transport Policy
645,Journal of Environmental Economics and Management
703,Journal of Labor Economics
908,Psychological Science
744,Journal of Regulatory Economics
1064,The American Economist
1082,The Electricity Journal
792,Journal of the Knowledge Economy
1136,The Pacific Review
336,Feminist Economics
965,Review of Financial Studies
207,EUROPEAN RESEARCH STUDIES JOURNAL
307,European Economic Review
185,Croatian Operational Research Review
232,Economic Modelling
264,Electoral Studies
121,Bulletin of Indonesian Economic Studies
245,Economics Letters
694,Journal of International Economic Law
103,Australian Economic History Review
854,Open Economies Review
587,Journal of Business Economics and Management
378,Global Social Policy
290,Environmental and Resource Economics
596,Journal of Commodity Markets
738,Journal of Public Economics
937,Research in International Business and Finance
270,Energy Economics
400,IEEE Transactions on Engineering Management
27,"African Journal of Food, Agriculture, Nutrition and Development"
119,British Journal of Political Science
213,Ecological Indicators
681,Journal of Human Development and Capabilities
972,Review of Political Economy
916,Public Policy and Administration
277,Entrepreneurship and Sustainability Issues
841,Nature Climate Change
688,Journal of Institutional Economics
365,German Economic Review
179,Corporate Ownership and Control
259,Economy of region
224,Economic Analysis and Policy
169,Computational Economics
159,Cliometrica
885,Politicka Ekonomie
191,Decisions in Economics and Finance
56,Annals of Economics and Finance
623,Journal of Economic Geography
1125,The Journal of Real Estate Finance and Economics
776,Journal of Water Sanitation and Hygiene for Development
695,Journal of International Economics
1055,Technological and Economic Development of Economy
60,Annals of Tourism Research
639,Journal of Education and Work
254,Economics of Transportation
761,Journal of Sustainable Development
331,European journal of social sciences
1217,iranian economic review
349,Foods
881,Political Research Quarterly
919,Quantitative Finance
836,Monthly Review
4,Academy of Accounting and Financial Studies Journal
1060,"Territory, Politics, Governance"
430,Intereconomics
928,Regional Research of Russia
1,ASTIN Bulletin
729,Journal of Population Economics
515,International Journal of Urban and Regional Research
1167,Tobacco Control
586,Journal of Business Economics
417,Indian journal of agricultural economics
941,Research in transportation business and management
814,Macroeconomics and Finance in Emerging Market Economies
266,Emerging Markets Finance and Trade
875,Policy Studies Journal
325,European Review of Economic History
233,Economic Policy
804,Land Use Policy
377,Global Policy
991,Scandinavian Economic History Review
1116,The Journal of Internet Banking and Commerce
699,Journal of International Studies
743,Journal of Regional Science
1195,Urban Policy and Research
598,Journal of Comparative Economics
1137,The Pakistan Development Review
648,Journal of Environmental Studies and Sciences
1035,Structural Change and Economic Dynamics
440,"International Environmental Agreements: Politics, Law and Economics"
749,Journal of Rural Studies
567,Journal of Applied Economics
357,Frontiers of Economics in China
1213,World Politics
1182,Transportation Research Part A: Policy and Practice
1191,Urban Affairs Review
698,Journal of International Money and Finance
1198,Utilities Policy
581,Journal of Behavioral and Experimental Finance
1062,The Accounting Review
197,Development Southern Africa
659,Journal of Financial Econometrics
910,Public Administration Review
778,Journal of World Business
538,International Sociology
509,International Journal of Technology Management
1054,Technological Forecasting and Social Change
115,Borsa Istanbul Review
960,Review of Economics of the Household
934,Research Policy
721,Journal of Peasant Studies
1203,Water Resources and Economics
72,Applied Economics Letters
872,Perspectives on Politics
1046,Sustainability
996,Small Business Economics
818,Managerial Finance
75,Applied Geography
502,International Journal of Sociology and Social Policy
1107,The Journal of Developing Areas
588,Journal of Business Ethics
670,Journal of Forest Economics
480,International Journal of Health Economics and Management
560,Journal of Agricultural Extension
679,Journal of Housing and the Built Environment
14,Acta Oeconomica
1192,Urban Forum
425,Innovation in Aging
362,Geoforum
194,Demography
333,Experimental Economics
376,Global Journal of Emerging Market Economies
1156,The World Economy
47,American Journal of Agricultural Economics
1202,Water Policy
334,Explorations in Economic History
1131,The Journal of Technology Transfer
276,Entrepreneurship Theory and Practice
28,"African Journal of Science, Technology, Innovation and Development"
976,Review of World Economics
756,Journal of Socio-economics
1045,Survival
1083,The Energy Journal
140,Central European Journal of Operations Research
879,Political Behavior
375,Global Food Security
130,CESifo Economic Studies
458,International Journal of Disaster Risk Reduction
150,Chinese Geographical Science
1014,Socio-economic Planning Sciences
324,European Review of Agricultural Economics
577,Journal of Banking Regulation
229,Economic Geography
882,Political Science Research and Methods
1011,Society and Economy
1093,The Geographical Journal
315,European Journal of Risk Regulation
338,Finance and Stochastics
943,Resources Policy
999,Social History
685,Journal of Industrial Relations
559,Journal of Agricultural Economics
863,PSL Quarterly Review
611,Journal of Cultural Economy
395,Housing Policy Debate
85,Asia Pacific Journal of Tourism Research
1008,Social science research
101,Asian journal of agriculture and rural development
339,Finance: Theory and Practice
712,Journal of Mathematical Economics
1150,The Singapore Economic Review
940,Research in World Economy
755,Journal of Social Sciences
939,Research in Transportation Economics
153,Cities
166,Comparative Political Studies
578,Journal of Banking and Finance
512,International Journal of Trade and Global Markets
489,International Journal of Managerial Finance
701,Journal of Islamic Accounting and Business Research
255,"Economics, Management, and Financial Markets"
973,Review of Quantitative Finance and Accounting
622,Journal of Economic Dynamics and Control
845,New Political Economy
187,Current Issues in Tourism
73,Applied Economics Quarterly
656,Journal of Family and Economic Issues
600,Journal of Comparative Policy Analysis: Research and Practice
827,Mediterranean journal of social sciences
144,China Agricultural Economic Review
394,Hitotsubashi Journal of Economics
985,Russian Linguistics
431,International Advances in Economic Research
479,International Journal of Green Economics
370,Global Economic Review
242,Economica
1025,South Asian Journal of Macroeconomics and Public Finance
438,International Economics and Economic Policy
58,Annals of Financial Economics
1079,The Economic History Review
669,Journal of Forecasting
188,Current Opinion in Environmental Sustainability
225,Economic Change and Restructuring
463,International Journal of Economics and Business Administration
397,"Housing, Theory and Society"
1102,The International Trade Journal
288,Environmental Impact Assessment Review
958,Review of Economics and Finance
634,Journal of Economic Studies
668,Journal of Financial and Quantitative Analysis
1129,The Journal of Social Sciences Research
208,Eastern Economic Journal
847,Nonprofit and Voluntary Sector Quarterly
299,Eurasian Geography and Economics
570,Journal of Asian Economics
50,American Journal of Sociology
356,Frontiers in Sociology
767,Journal of Theoretical Politics
955,Review of Economic Dynamics
619,Journal of Econometrics
1172,Tourism Management Perspectives
388,Historia
563,Journal of Agriculture and Rural Development in the Tropics and Subtropics
786,Journal of the American Planning Association
671,Journal of Futures Markets
629,Journal of Economic Methodology
1063,The American Economic Review
663,Journal of Financial Markets
461,International Journal of Economic Policy in Emerging Economies
117,British Actuarial Journal
664,Journal of Financial Regulation and Compliance
736,Journal of Public Affairs
287,Environmental Economics and Policy Studies
931,Regional Studies
782,Journal of economic development
900,Problemos
802,Labour Economics
347,Food Policy
737,Journal of Public Economic Theory
482,International Journal of Housing Markets and Analysis
974,Review of Radical Political Economics
423,Information Technology for Development
1059,Telecommunications Policy
1208,World Bank Research Observer
627,Journal of Economic Issues
168,Competition and Regulation in Network Industries
651,Journal of European Public Policy
997,Social Choice and Welfare
667,Journal of Financial Stability
628,Journal of Economic Literature
449,International Journal of Central Banking
949,Review of Behavioral Finance
464,International Journal of Economics and Business Research
7,Academy of Strategic Management Journal
1138,The Political Quarterly
183,Critical Sociology
285,"Environment, Development and Sustainability"
198,Development and Change
1178,Transportation
1022,South African Journal of Economic and Management Sciences
911,Public Choice
291,Environmental development
891,Population and Development Review
1076,The British journal of sociology
136,Case Studies on Transport Policy
134,Canadian Studies in Population
725,Journal of Policy Modeling
839,National Tax Journal
889,Population Space and Place
487,International Journal of Islamic and Middle Eastern Finance and Management
1211,World Economy and International Relations
141,Cepal Review
302,European Actuarial Journal
697,Journal of International Migration and Integration
1181,Transportation Research Part A-policy and Practice
26,African Journal of Economic and Management Studies
704,Journal of Labor Research
775,Journal of Urban Management
222,Economic Affairs
1067,The American economic review
850,Nova Economia
273,"Energy, Sustainability and Society"
116,Brazilian Business Review
261,Ecosystem services
1003,Social Science History
327,European Sociological Review
155,Clean Technologies and Environmental Policy
961,Review of Environmental Economics and Policy
504,International Journal of Supply Chain Management
544,International journal of environmental and science education
693,Journal of International Development
1048,"Sustainability: Science, Practice and Policy"
720,Journal of Peace Research
61,Annals of economics and statistics
1142,The Review of Austrian Economics
342,Financial Innovation
715,"Journal of Money, Credit and Banking"
866,Panoeconomicus
784,Journal of international women's studies
69,Applied Econometrics and International Development
484,International Journal of Industrial Organization
1151,The Social Science Journal
163,Comparative Economic Studies
268,Empirica
1005,Social Sciences
392,History of Economic Thought and Policy
894,Portuguese Economic Journal
238,Economic and Industrial Democracy
129,Business and Politics
156,Climate Change Economics
897,Poverty & Public Policy
142,Child Indicators Research
631,Journal of Economic Policy Reform
346,Fiscal Studies
780,Journal of World-Systems Research
1101,The International Spectator
856,Operations Research and Decisions
1000,Social Inclusion
912,Public Finance Quarterly
209,Eastern European Economics
592,Journal of Chinese Economic and Business Studies
1201,Water Economics and Policy
1196,Urban Studies
76,Applied Mathematical Finance
1070,The Antitrust Bulletin
396,Housing Studies
801,Labor Studies Journal
401,IMF Economic Review
734,Journal of Productivity Analysis
237,Economic Theory
539,International Studies Quarterly
399,IDS Bulletin
384,Habitat International
692,"Journal of International Commerce, Economics and Policy"
178,Contributions to Management Science
566,Journal of Applied Econometrics
514,International Journal of Urban Sustainable Development
246,Economics and Business Letters
371,Global Economy Journal
230,Economic History of Developing Regions
231,Economic Inquiry
304,European Business Organization Law Review
1023,South African Journal of Economics
637,Journal of Economics and Economic Education Research
557,Journal of African Economies
680,Journal of Human Capital
272,Energy research and social science
20,Advances in Accounting
43,American Economic Journal: Economic Policy
241,Economic and Social Review
607,Journal of Contemporary China
419,Industrial and Corporate Change
219,Econometrics and Statistics
803,Land Economics
1158,The journal of real estate portfolio management
938,Research in Social Stratification and Mobility
15,Acta Sociologica
1052,Synthese
271,Energy for Sustainable Development
967,Review of International Political Economy
102,Atlantic Economic Journal
530,International Review of Economics
531,International Review of Economics Education
1032,Statistical journal of the IAOS
1006,Social Sciences in China
146,China Economic Review
118,British Food Journal
793,Journal of the Operational Research Society
212,Ecological Economics
1029,Spatial Economic Analysis
1155,The World Bank Economic Review
1072,The Australasian Journal of Regional Studies
665,Journal of Financial Research
284,Environment and Urbanization Asia
966,Review of Industrial Organization
363,Geographical Research
892,Population and Economics
416,Indian Journal of Human Development
495,International Journal of Production Economics
989,Safety Science
306,European Countryside
719,Journal of Optimization Theory and Applications
543,International journal of disaster risk reduction
846,New Zealand Economic Papers
677,Journal of Happiness Studies
90,Asian Academy of Management Journal of Accounting and Finance
203,Dynamic Games and Applications
582,Journal of Benefit-Cost Analysis
281,Environment and Planning B: Urban Analytics and City Science
216,Econometric Theory
789,Journal of the Association of Environmental and Resource Economists
828,Middle East Development Journal
524,International Organization
269,Empirical Economics
398,Human Ecology
226,Economic Computation and Economic Cybernetics Studies and Research
860,Oxford Development Studies
160,Cogent Social Sciences
300,Europe-Asia Studies
516,International Journal of Water Resources Development
1164,Third World Quarterly
700,Journal of International and Comparative Social Policy
1053,TOP
727,Journal of Political Economy
295,Estudios De Economia
1047,Sustainability Science
359,Games
760,Journal of Statistical Mechanics: Theory and Experiment
410,India Quarterly
597,Journal of Community Positive Practices
320,European Planning Studies
335,FIIB Business Review
971,Review of Pacific Basin Financial Markets and Policies
643,Journal of Empirical Finance
613,Journal of Developing Societies
956,Review of Economic Perspectives
217,Econometrica
381,Governance
702,"Journal of Islamic Economics, Banking and Finance"
1040,Studies in Higher Education
67,Antipode
545,Intertax
354,Forum for Social Economics
921,Quarterly Journal of Economics
94,Asian Economic Papers
986,SAGE Open
70,Applied Economic Perspectives and Policy
138,Cato Journal
236,Economic Systems Research
1074,The B.E. Journal of Theoretical Economics
448,International Journal of Business and Society
1089,The European Journal of the History of Economic Thought
696,"Journal of International Financial Markets, Institutions and Money"
243,Economics
1127,The Journal of Retirement
947,Review of Accounting Studies
1184,Transportation Research Part D: Transport and Environment
491,International Journal of Monetary Economics and Finance
995,Scientometrics
1173,Town Planning Review
1210,World Development Perspectives
45,American Economic Journal: Microeconomics
475,International Journal of Financial Studies
1061,The ANNALS of the American Academy of Political and Social Science
610,Journal of Cultural Economics
1051,Swiss Journal of Economics and Statistics
476,International Journal of Forecasting
383,HSE Economic Journal
1162,Theory and Decision
878,Political Analysis
834,Montenegrin journal of economics
963,Review of Finance
641,"Journal of Elections, Public Opinion and Parties"
345,Finanzarchiv
88,Asia-Pacific Journal of Regional Science
311,European Journal of Law and Economics
650,Journal of European Integration
500,International Journal of Social Economics
621,Journal of Economic Cooperation and Development
722,Journal of Pension Economics and Finance
615,Journal of Development Effectiveness
372,Global Environmental Change
859,Organization Studies
579,Journal of Behavioral Finance
1019,Sociological Science
733,Journal of Poverty
215,Econometric Reviews
240,Economic and Political Weekly
181,Critical Review
753,Journal of Social Entrepreneurship
95,Asian Economic and Financial Review
44,American Economic Journal: Macroeconomics
506,International Journal of Sustainable Economy
113,Berkeley Planning Journal
832,Modern Asian Studies
978,Revista Brasileira De Economia
143,Children and Youth Services Review
41,American Book Review
96,Asian Journal of Technology Innovation
42,American Economic Journal: Applied Economics
571,"Journal of Asian Finance, Economics and Business"
1002,Social Policy and Society
726,Journal of Political Ecology
66,Annual Review of Resource Economics
930,Regional Science and Urban Economics
988,SSM - Population Health
507,International Journal of Sustainable Transportation
517,International Journal of the Economics of Business
1161,Theoretical Economics
790,Journal of the European Economic Association
654,Journal of Evolutionary Economics
434,International Business Review
455,International Journal of Consumer Studies
467,International Journal of Educational Development
564,Journal of Air Transport Management
1091,The Geneva Papers on Risk and Insurance - Issues and Practice
883,Political Studies
228,Economic Development and Cultural Change
68,Applied Econometrics
151,Chinese Journal of Population Resources and Environment
762,Journal of Sustainable Forestry
1147,The Round Table
777,Journal of Wine Economics
442,International Forestry Review
312,European Journal of Political Economy
959,Review of Economics and Statistics
282,Environment and Planning C: Government and Policy
355,Frontiers in Psychology
638,Journal of Economics and Finance
584,Journal of Borderlands Studies
249,Economics and human biology
632,Journal of Economic Psychology
522,International Migration Review
763,Journal of Sustainable Tourism
565,Journal of Applied Business Research
145,China Economic Journal
74,Applied Financial Economics
1030,Spatial Economics
635,Journal of Economic Theory and Econometrics
1050,Sustainable Development
124,Business History
81,Artificial Intelligence
835,Monthly Labor Review
1004,Social Science Quarterly
443,International Gambling Studies
24,African Geographical Review
1100,The International Journal of the Commons
1103,The Journal of Agricultural Education and Extension
533,International Review of Law and Economics
975,Review of Social Economy
1058,Technovation
170,Computational Management Science
626,Journal of Economic Interaction and Coordination
750,Journal of Rural and Development
523,International Organisations Research Journal
462,International Journal of Economic Theory
890,Population Studies
678,Journal of Housing Economics
968,Review of Keynesian Economics
496,International Journal of Production Research
913,Public Finance Review
542,International journal of business
686,Journal of Industrial and Management Optimization
825,Measurement
742,Journal of Real Estate Research
105,Australian Journal of Agricultural and Resource Economics
906,Progress in Human Geography
1121,The Journal of Peasant Studies
52,American Politics Research
838,National Institute Economic Review
1214,"World Review of Entrepreneurship, Management and Sustainable Development"
483,International Journal of Housing Policy
964,Review of Financial Economics
661,Journal of Financial Economics
990,Scandinavian Actuarial Journal
857,Optimization
218,Econometrics
1109,The Journal of Economic Education
1106,The Journal of Derivatives
844,New Medit
920,Quarterly Journal of Austrian Economics
5,Academy of Entrepreneurship Journal
318,European Journal of Sustainable Development
833,Moneta e Credito
167,Comparative Sociology
36,Agricultural and Resource Economics Review
199,Development in Practice
433,International Business Management
609,Journal of Corporate Finance
1065,The American Journal of Economics and Sociology
1086,The European Journal of Development Research
568,Journal of Applied Statistics
902,Problems and perspectives in management
192,Defence and Peace Economics
766,Journal of The Japanese and International Economies
510,International Journal of Theoretical and Applied Finance
532,International Review of Financial Analysis
1154,The Urban Book Series
100,Asian and Pacific Migration Journal
981,Risks
769,Journal of Transport Economics and Policy
735,Journal of Property Research
29,Ageing and Society
51,American Political Science Review
227,Economic Development Quarterly
1028,Southern Economic Journal
534,International Review of Management and Marketing
293,Equilibrium. Quarterly Journal of Economics and Economic Policy
404,IZA Journal of European Labor Studies
798,Judgment and Decision Making
1123,The Journal of Portfolio Management
403,IZA Journal of Development and Migration
1017,Sociologia Ruralis
1078,The Chinese Economy
466,International Journal of Education Economics and Development
794,Journal of the Royal Statistical Society: Series A (Statistics in Society)
78,Applied Spatial Analysis and Policy
932,"Regional Studies, Regional Science"
432,International Affairs
800,Labor History
99,Asian Survey
909,Public Administration
880,Political Geography
279,Environment and Planning A
350,Foreign Affairs
23,African Development Review
601,Journal of Competition Law and Economics
382,Group Decision and Negotiation
1193,Urban Geography
852,Oeconomia Copernicana
815,Management Science
962,Review of European Studies
772,Journal of Travel Research
1110,The Journal of Economic History
1168,Tourism Analysis
468,International Journal of Emerging Markets
521,International Migration
83,Asia Pacific Business Review
501,International Journal of Social Welfare
326,European Societies
457,International Journal of Development Issues
540,International Studies Review
518,International Journal on Food System Dynamics
139,Central Bank Review
